{"authority":{"deployment_authorized":false,"install_authorized":false,"production_authorized":false,"runtime_authorized":false},"behavior":{"activation_contract_sha256":"160903e7c03ad8295cd3d8dcf600344e3f36da9819b58252153859ca3b4d6dfa","expected_first_run_sha256":"a87d5eebfefb18f135f83273af0681e34917482c78a89a67d0a506693d0422bc","knowledge_gated":true,"unknown_behavior":"ESCALATE"},"content":{"knowledge_package_sha256":"d70d3d4d59cba1ad7a12b7120d6016a5422060663164860c4c25114969c06ce1","knowledge_review_sha256":"ce8c65331ec4fa36cf7aa2906826f382197e3b225b67fcefd7e55bba54c6fcf1","module_set_sha256":"26e91b67997aebf65e4301758b4e4b14327f3cd2398f29d2a7dbde86f4820b50","presence_binding_sha256":"d9672bb7f179a99d8112a300ae0cd964859a67ccede385f0f033ccb8ce7de9d3","system_prompt_sha256":"9547ed290b7c24e822ee2f0fa5c021cdb34be8b910fecd7bd0396719326dd4a0"},"contract_sha256":"ea6d33757cf7236fd4b258a6dc8ffe97b79bb4e69e8dcf329ebd46be99562770","identity":{"agent_name":"Ava","agent_slug":"ava","chassis_id":"operational-qa-concierge","chassis_sha256":"7b9ec705ccdbac09272964485ea3d71ae06d6c0afe7874fc06291e90c931bde2","chassis_version":"1.0.0","client_id":"summit-home-services","client_name":"Summit Home Services"},"installation":{"baseline_sha256":"6a9e871ea819badc6f9b1542b9cf1f10ee2256ae1e8236faf84697a5347945d8","rollback_contract_sha256":"75029c5d5db55f328bf3d9904086835491c77e21cb10770f20399e7511a65529","target_profile_path":"profiles/xagent-ava-home-services-concierge"},"instance_id":"xi-ava-home-services-concierge-bb4a8c","mission_id":"draft-ava-home-services-concierge-20260826-014140-bb4a8c","provenance":{"blueprint_sha256":"ebad2d381be662a6ef4b6061776a74d6e3c5a38a2d948305e1903dbb3f09564f","commissioning_sha256":"c4724667163387c929f08065c9a887207caabaee3d05718025a649a45d5af28f","final_vera_sha256":"089dba554bd900fc2d4cc11c64c0e73af69f9914c84b052c9560b045a530e18e","runtime_foundry_input_sha256":"dfec9f1436d848489cb9cf3578bdc15135fd1b67848afd8cb7afa9a141870d13"},"revision":1,"runtime":{"delegation":"disabled","external_actions":"disabled","memory":"disabled","model":"gpt-5.6-luna","profile_name":"xagent-ava-home-services-concierge","provider":"openai-codex","reasoning":"low","retries":"disabled","tools":"disabled"},"schema_version":"0.1","status":"INSTANCE_RUNTIME_CONTRACT_LOCKED"}
